genre_category,artist_genres
International,"alt z, australian pop, electropop, pop, post-teen pop, swedish pop, viral pop"
International,"alt z, australian pop, electropop, pop, post-teen pop, swedish electropop"
International,"alt z, australian pop, dance pop, electropop, nyc pop, pop, pop dance, pop edm, post-teen pop, tropical house, uk pop"
Dance,"alt z, art pop, electropop, indie pop, indie poptimism, nyc pop, pop"
Rock,"album rock, classic rock, rock, soft rock, yacht rock"
Rock,"album rock, classic rock, permanent wave, rock"
Rock,"album rock, classic rock, mellow gold, rock, soft rock, yacht rock"
Rock,"album rock, classic rock, mellow gold, new wave pop, rock, soft rock, yacht rock"
Rock,"album rock, classic rock, hard rock, mellow gold, rock, soft rock"
Rock,"album rock, classic rock, country rock, folk rock, heartland rock, mellow gold, rock, singer-songwriter, soft rock, yacht rock"
Rock,"album rock, classic rock, country rock, folk rock, heartland rock, mellow gold, pop rock, rock, singer-songwriter, soft rock"
Rock,"album rock, birmingham metal, hard rock, metal, rock"
Rock,"album rock, beatlesque, classic rock, folk rock, mellow gold, rock, soft rock"
Rock,"album rock, art rock, blues rock, classic rock, mellow gold, soft rock, sophisti-pop"
Rock,"album rock, art rock, blues rock, classic rock, mellow gold, new wave pop, soft rock, sophisti-pop"
Rock,"album rock, art rock, beatlesque, classic rock, mellow gold, rock"
International,alberta hip hop
International,"albanian hip hop, kosovan pop"
International,"albanian hip hop, german hip hop"
International,"albanian hip hop, german drill, german hip hop"
Hip-Hop,"alabama rap, rap, trap, vapor trap, viral rap"
Hip-Hop,alabama rap
International,"afroswing, uk dancehall, uk hip hop"
International,"afroswing, london rap, uk hip hop"
International,"afroswing, grime, uk hip hop"
International,"afroswing, grime, london rap, uk alternative hip hop, uk hip hop"
Other,afroswing
Other,"afropop, malian blues, mande pop, wassoulou, world"
Hip-Hop,"afrofuturismo brasileiro, bass trap, electronic trap, funk carioca, pop nacional"
Other,"afrofuturism, pop"
Other,"afrofuturism, alternative r&b, dance pop, escape room, hip pop, indie soul, neo soul, pop, r&b, urban contemporary"
Other,"afrofuturism, alternative r&b, art pop, escape room, experimental r&b, pop, trip hop"
International,"afro soul, south african pop"
International,"afro house, deep house, south african house, south african pop dance"
Other,"afro dancehall, dancehall, nigerian hip hop, nigerian pop"
International,"afro dancehall, azonto, dance pop, uk pop"
International,"afro dancehall, afropop, ghanaian hip hop, nigerian pop, swedish dancehall"
Other,"afro dancehall, afropop, azonto, nigerian hip hop, nigerian pop"
Hip-Hop,"aesthetic rap, meme rap, viral rap"
Other,"adult standards, lounge, vocal jazz"
Other,"adult standards, lounge, torch song, vocal jazz"
Other,"adult standards, jump blues, lounge, swing, vocal jazz"
Other,"adult standards, jazz trio, lounge"
Other,"adult standards, jazz blues, lounge, swing, vocal jazz"
Other,"adult standards, hollywood, lounge, torch song, vocal jazz"
Other,"adult standards, easy listening, lounge, vocal jazz"
Other,"adult standards, easy listening, lounge"
Rock,"adult standards, disco, jazz funk, jazz guitar, quiet storm, smooth jazz, soul jazz, yacht rock"
Other,"adult standards, cowboy western, oklahoma country, traditional country, yodeling"
International,"adult standards, canadian pop, jazz pop, lounge"
Other,"adult standards, brill building pop, easy listening, lounge, vocal jazz"
Rock,"adult standards, brill building pop, easy listening, lounge, rockabilly"
Other,"adult standards, brill building pop, easy listening, lounge, mellow gold"
Other,"adult standards, brill building pop"
Other,"adult standards, american folk revival, lounge"
Rock,"acoustic pop, neo mellow, pop, pop rock"
Other,a cappella
